7;5;"Suivi personnalisé selon ces habitudes alimentaires, sa condition physique...Rappel pour l'hydratationTout est géré par l'application, suivi poids, course, recette selon nos besoins";Intrusion dans la vie privée des personnes, données personnelles. ;2;7;1;1;1;5;1;1;1;7;7;7;7;7;1;1;1;1;1;7;6;7;4;4;5;5;6;5;60;60;2;23;2
1;2;Ça permet de se rendre compte des données qui sont récoltées par les divers appareils connectés et de les exploiter;Trop intrusif, on a l'impression que les données collectées par les appareils connectés sont public;7;7;4;1;1;6;1;2;1;7;7;2;7;5;2;1;1;1;1;3;5;2;3;4;5;3;5;2;18;8;1;23;1
7;1;Le chatbot est disponible 24/7 pour répondre aux questions et les données sont traitées en temps réel sans délai.;Je suis inquiète de la confidentialité de mes données et que les réponses ne sont pas toujours cohérentes. Les IA me font peur.;7;7;3;1;1;2;2;2;1;7;7;3;7;7;3;2;1;1;1;4;4;1;4;3;5;2;3;1;0;0;1;23;2
4;5;"Détenir l’information avoir des objectifs individualisés ";"Être pisté en permanence Ne pas y arriver et se décourager ";2;6;5;2;1;2;1;2;1;5;5;5;5;5;2;2;2;1;2;5;5;5;4;5;5;5;5;5;50;55;2;32;2
4;5;Cela peut être motivant, si challenge et succès a atteindre. ;C est virtuel qd même, toujours etre sur le portable deshumanise la notion de coach ;4;5;2;2;1;1;1;1;1;5;5;5;5;5;1;1;1;1;1;5;5;5;4;4;4;4;4;4;30;20;2;53;2
7;5;"Regarder l'évolution de son activité sportiveVérifier son état de santé ";Le chat oat ne peut pas répondre à des questions poussées sur la nutrition par exemple ;7;7;5;1;5;6;2;5;2;5;3;3;1;6;1;1;1;2;1;5;4;6;6;5;7;5;6;6;51;82;2;22;2
3;1;La Disponibilité et c’est pas cher. Je ne vois pas d’autres avantages ;Moins d’échange humains.... l’avenir de la société est en jeu. Un emploie de moins pour une personne physique ;3;5;3;1;1;2;1;1;1;7;7;7;7;7;3;1;1;1;1;5;5;3;4;3;4;2;2;1;50;19;2;23;1
7;6;Avoir un suivi et du soutien et plus particulièrement des conseils ;Pas particulièrement d’inconvénient mais il faut être régulier et avoir le temps de l’utiliser ;7;6;5;3;4;3;3;4;2;6;6;6;6;6;6;6;6;6;6;6;6;6;6;6;6;5;5;4;75;49;1;19;2
4;4;Les statistiques assez précises, et complète. Et il semble d’avoir un suivi plutôt complet, sans doute pour voir les progrès sur plusieurs périodes.;Le défaut de ces qualités j’imagine. Le suivi de la motivation est souvent très artificiel, et infantilisant, un suivie personnalisé mais pas personnel pour résumer.;5;5;5;1;1;4;1;1;1;5;5;5;5;5;1;1;1;1;1;5;5;4;3;3;5;4;4;4;45;45;2;29;1
7;6;Ce genre de coaching est très personnalisé et permet donc des progrès certainement plus rapides (car adaptés aux besoins). De plus, cela permet d'avoir un suivi quotidien qui évolue selon notre progression et selon nos habitudes. Cela permet également de manger plus sainement. ;"Les inconvénients sont principalement en termes de vie privée selon moi. L'application connait mon alimentation (elle a accès à mon frigo !) et donc peut me ""juger"" sur ce que je mange ou ne mange pas. De plus, cela peut être un peu intrusif, par exemple si l'application nous rappelle sans cesse de boire, d'avoir l'impression qu'on est sans arrêt surveillé sur notre bonne/mauvaise conduite en terme de nutrition et d'activité sportive. ";5;6;3;1;3;5;1;4;1;6;6;6;6;6;5;1;1;1;1;5;5;5;4;4;5;4;5;4;65;80;1;24;2
;;;;;;;;;;;;;;;;;;;;;;;;;;;;;;;;;;;;
7;4;"Suivi en temps réel Suivi plus professionnel Base sur des données claires et visibles ";"Trop connecté, se sentir fliqué Pas de conseils réels ";6;6;6;5;2;2;2;2;5;6;6;6;6;6;6;2;2;2;2;5;4;5;5;5;5;4;6;4;51;67;2;24;2
4;3;c'est pratique, surtout quand on travaille et qu'on a pas le temps d'aller dans une salle de sport ;il peut y avoir des risques concernant les données personnelles et ça ne remplacera jamais la personnalisation que peut apporter un coach humain ;1;5;2;1;1;1;1;1;1;7;7;7;3;6;1;1;1;1;1;5;5;5;4;4;1;5;5;4;20;19;2;25;2
6;6;Cela permet de connaître l’évolution de ses progrès ;Je ne vois pas d’inconvénients pour ma part, ça à l’air d’être une  bonne application ;6;7;5;4;1;4;1;1;1;6;7;7;7;7;4;1;1;1;1;7;7;7;6;6;6;5;6;4;100;100;2;38;2
4;4;"L'application est GratuiteElle est aussi Disponible h24";"Je peux arreter de rentrer mes donnes personnes ne me demandera pkoi (manque de suivi)";7;7;4;2;1;4;1;1;1;5;7;7;7;7;5;2;2;2;2;5;5;5;5;5;5;5;5;4;60;60;2;31;2
3;1;Elle permet de se comparer à une moyenne et des statistiques vérifiées, variées et plus poussées que celles que l'on pourrait trouver par nous-même. Permet de constater ses progrès/évolutions.;Service trop générique et donc pas assez personnalisé. Ne semble pas prendre en compte toutes les spécificités liées à la morphologie, métabolisme et habitudes de l'utilisateur, il y a donc un risque de suivi mal adapté ne se basant que sur des moyennes.;2;6;1;1;1;1;1;1;1;7;7;7;7;7;4;1;1;1;1;5;6;4;3;2;3;3;5;2;30;50;1;24;2
3;2;"Cette application peut permettre aux personnes mal dans leur peau de ne pas se retrouver en face de quelqu'un et de se retrouver en situation de ""honte"". De plus cela peut éviter certains problèmes, conflits entre deux personnes, comme des remarques désagréables qui pourraient complexer les clients.";Il y a un manque de subjectivité, en effet vu qu'il ne s'agit pas d'un être humain, il ne peut pas ressentir les sensations du client. ;6;6;3;1;3;3;1;1;1;7;7;7;7;7;1;1;1;1;1;5;5;5;4;4;5;3;5;4;40;40;1;18;2
3;2;"Le fait d'utiliser cette application vous permettera de suivre votre alimentation ainsi que vos activités sportifsDe plus, l'application peut être directement connectée à votre SmartWatch... ";Certe l'application vous permet un suivi quotidien, mais ses calculs restent approximatifs selon l'intelligence integré dans le code. Alors que le corps humain est unique et son traitement ou son adaptation côtés nutriments ou besoin caloriques doit être faites par un spécialiste selon l'historique de la personne concernée (maladies, ex régime, etc);4;4;1;1;1;4;1;1;1;5;7;7;6;7;6;2;2;2;2;5;4;6;3;3;5;4;6;6;80;51;2;24;2
3;3;Ñnnnnnnnnnslsldlxlxxldmdlskskskskskxfekslssldxkdldlslslsslsllssllsdldkdldlslslslslslslslslsllslslslsslsllslsls;Ñnnnnnnnnnslsldlxlxxldmdlskskskskskxfekslssldxkdldlslslsslsllssllsdldkdldlslslslslslslslslsllslslslsslsllslsls ;1;1;1;3;1;1;1;6;1;1;6;6;2;7;1;2;1;1;2;2;2;3;1;1;1;1;6;2;54;58;3;74;1
5;1;Un suivi quotidien de poids, de l'activité physique , plus pratique/rapide qu'un coach en salle de sport ;Cela ne m'a pas l'air d'être une vrai personne en face, mais plutôt un logiciel.;7;7;5;1;3;5;1;1;1;7;7;7;7;7;1;1;1;1;1;6;5;4;5;5;5;4;4;3;3;6;2;29;2
5;5;La rapidité et l'apparente efficacité.  C'est aussi bien pratique de l'avoir sur soi, pas besoin de rendez-vous avec qui que ce soit ;Je ne vois pas si on peut poser des questions particulières,  ni si on peut formater l'appli pour prendre en compte certaines pathologies,  allergies etc. ;6;1;1;1;1;1;1;1;1;7;7;7;7;7;1;1;1;1;1;5;5;5;4;4;5;5;5;5;60;60;2;49;2
3;2;"Evaluations statistiques des progrès possibles (qu'en est-il en cas d'échec?)Education alimentaire accessible à tous";"Renforce la croyance que les maladies chroniques liées à l'obésité ont pour unique cause un problème d'alimentation.Lassitude d'être encouragé par un programme comparé à une interaction humaine.Quid de la modification réelle des comportements alimentaires des personnes utilisant ces applications ?Quid de la protection des données personnelles liées à la santé ?";1;1;1;1;1;4;1;1;4;4;4;4;4;4;1;1;1;1;1;3;4;2;3;3;5;4;3;1;1;10;2;30;2
7;2;Si on n'arrive pas à faire les choses soi-même, c'est une bonne chose, puisqu'il convient d'avoir quelqu'un qui nous guide si on n'est dans l'impossibilité de gérer soi-même les choses;RGPD non respecté a priori, très intrusif sans que la personne ne le comprenne forcément, puisque, dans ce cas, l'on voit bien que la personne semble ne pas avoir donné son accord exprès et certain sur l'utilisation des données à caractère personnel, ce qui constitue, en soi, une infraction;1;1;1;1;1;1;1;1;1;5;5;4;3;3;1;1;1;1;1;4;4;1;1;1;1;1;1;1;0;0;2;99;3
7;6;"Un suivi personnalisé, basé sur des données concrètesUne analyse et utilisation des données pertinente et automatique ";"Un achat et une utilisation quotidienne des objets connectés (coût, habitudes à mettre en place)Protection des données et de la vie privée à voir";1;5;1;1;1;5;2;3;2;7;7;7;7;6;2;2;2;2;1;6;6;6;4;4;5;5;4;4;55;55;2;29;1
4;4;En cas d’écarts importants, une prise de conscience pour reprendre les bonnes habitudes.;Aucun inconvénients pour ma part. Il faudra juste ne pas tomber dans la frustration ;5;5;2;1;1;3;3;1;1;6;4;6;4;5;1;3;3;3;5;5;5;5;4;4;4;5;4;3;33;46;2;35;2
3;1;Explication des données (pas juste les graphiques sans information supplémentaire) et nombre de données importantes (pas juste un graphique);On remarque de suite que c'est automatisé (phrase pre ecrite en fonction du resultalt sur le graphique), du coup une fois que l'on sait lire le graphique, le service n'est plus utile;5;7;1;1;1;3;1;2;1;6;7;6;7;6;1;1;1;1;4;6;6;6;3;3;6;6;4;4;70;49;2;26;2
7;2;"Les avantages peuvent être le fait d'être suivi régulièrement, et d'éviter t'auto-évaluer ses besoins et risquer des mauvaises interprétations. Elle a l'air complète et polyvalente dans les domaines sur lesquels elle agit.";"L'inconvénient premier que je vois est le fait que c'est quand même très intrusif et peut devenir anxiogène pour certaines personnes. Une personne qui est mal dans sa peau ou a peu confiance peut se sentir stressée et utiliser l'application d'une mauvaise façon. Les écarts peuvent aussi devenir de vrais échecs et un vrai stress, alors que c'est tout à fait normal à mon avis. On peut se sentir emprisonnée et dépendante de cette application qui peut suivre tous ses mouvements et actions pendant la journée. ";3;5;2;1;1;2;1;1;1;6;5;5;5;5;2;1;1;1;1;6;6;3;4;4;6;4;3;4;1;1;2;26;2