10/06/20 22:53;10/06/20 23:05;0;41.92.68.226;100;738;1;10/06/20 23:05;R_2rAZEAB4JP5e1Ut;;;;;34,01229858;-6,848403931;anonymous;EN;3;2;"Le fait d'utiliser cette application vous permettera de suivre votre alimentation ainsi que vos activités sportifsDe plus, l'application peut être directement connectée à votre SmartWatch... ";Certe l'application vous permet un suivi quotidien, mais ses calculs restent approximatifs selon l'intelligence integré dans le code. Alors que le corps humain est unique et son traitement ou son adaptation côtés nutriments ou besoin caloriques doit être faites par un spécialiste selon l'historique de la personne concernée (maladies, ex régime, etc);4;4;1;1;1;4;1;1;1;5;7;7;6;7;6;2;2;2;2;5;4;6;3;3;5;4;6;6;80;51;2;24;2
15/06/20 23:33;15/06/20 23:47;0;93.28.149.216;100;809;1;15/06/20 23:47;R_3hsDPKGGIDdPfSf;;;;;48,72489929;1,374893188;anonymous;EN;3;3;Ñnnnnnnnnnslsldlxlxxldmdlskskskskskxfekslssldxkdldlslslsslsllssllsdldkdldlslslslslslslslslsllslslslsslsllslsls;Ñnnnnnnnnnslsldlxlxxldmdlskskskskskxfekslssldxkdldlslslsslsllssllsdldkdldlslslslslslslslslsllslslslsslsllslsls ;1;1;1;3;1;1;1;6;1;1;6;6;2;7;1;2;1;1;2;2;2;3;1;1;1;1;6;2;54;58;3;74;1
16/06/20 9:20;16/06/20 9:26;0;90.52.237.249;100;323;1;16/06/20 9:26;R_2qrt70hE65p4QiP;;;;;45,73539734;3,196105957;anonymous;EN;5;1;Un suivi quotidien de poids, de l'activité physique , plus pratique/rapide qu'un coach en salle de sport ;Cela ne m'a pas l'air d'être une vrai personne en face, mais plutôt un logiciel.;7;7;5;1;3;5;1;1;1;7;7;7;7;7;1;1;1;1;1;6;5;4;5;5;5;4;4;3;3;6;2;29;2
16/06/20 9:34;16/06/20 9:40;0;77.203.33.90;100;361;1;16/06/20 9:40;R_3kbLbiv2axMAd1C;;;;;46,15890503;-1,008605957;anonymous;EN;5;5;La rapidité et l'apparente efficacité.  C'est aussi bien pratique de l'avoir sur soi, pas besoin de rendez-vous avec qui que ce soit ;Je ne vois pas si on peut poser des questions particulières,  ni si on peut formater l'appli pour prendre en compte certaines pathologies,  allergies etc. ;6;1;1;1;1;1;1;1;1;7;7;7;7;7;1;1;1;1;1;5;5;5;4;4;5;5;5;5;60;60;2;49;2
16/06/20 10:44;16/06/20 10:58;0;82.229.120.33;100;857;1;16/06/20 10:58;R_eWjmSWglGdjXkuB;;;;;47,18139648;-1,549697876;anonymous;EN;3;2;"Evaluations statistiques des progrès possibles (qu'en est-il en cas d'échec?)Education alimentaire accessible à tous";"Renforce la croyance que les maladies chroniques liées à l'obésité ont pour unique cause un problème d'alimentation.Lassitude d'être encouragé par un programme comparé à une interaction humaine.Quid de la modification réelle des comportements alimentaires des personnes utilisant ces applications ?Quid de la protection des données personnelles liées à la santé ?";1;1;1;1;1;4;1;1;4;4;4;4;4;4;1;1;1;1;1;3;4;2;3;3;5;4;3;1;1;10;2;30;2
16/06/20 11:17;16/06/20 11:21;0;185.127.242.156;100;267;1;16/06/20 11:21;R_1gkDNo1GrGZUJov;;;;;48,9282074;7,663803101;anonymous;EN;7;2;Si on n'arrive pas à faire les choses soi-même, c'est une bonne chose, puisqu'il convient d'avoir quelqu'un qui nous guide si on n'est dans l'impossibilité de gérer soi-même les choses;RGPD non respecté a priori, très intrusif sans que la personne ne le comprenne forcément, puisque, dans ce cas, l'on voit bien que la personne semble ne pas avoir donné son accord exprès et certain sur l'utilisation des données à caractère personnel, ce qui constitue, en soi, une infraction;1;1;1;1;1;1;1;1;1;5;5;4;3;3;1;1;1;1;1;4;4;1;1;1;1;1;1;1;0;0;2;99;3
16/06/20 12:41;16/06/20 12:48;0;85.169.54.168;100;391;1;16/06/20 12:48;R_2cnhQbHMFq7HDdU;;;;;43,37219238;5,353897095;anonymous;EN;7;6;"Un suivi personnalisé, basé sur des données concrètesUne analyse et utilisation des données pertinente et automatique ";"Un achat et une utilisation quotidienne des objets connectés (coût, habitudes à mettre en place)Protection des données et de la vie privée à voir";1;5;1;1;1;5;2;3;2;7;7;7;7;6;2;2;2;2;1;6;6;6;4;4;5;5;4;4;55;55;2;29;1
16/06/20 13:05;16/06/20 13:16;0;37.170.72.158;100;667;1;16/06/20 13:16;R_2OJZ451xdjbvUH2;;;;;48,85820007;2,338699341;anonymous;EN;4;4;En cas d’écarts importants, une prise de conscience pour reprendre les bonnes habitudes.;Aucun inconvénients pour ma part. Il faudra juste ne pas tomber dans la frustration ;5;5;2;1;1;3;3;1;1;6;4;6;4;5;1;3;3;3;5;5;5;5;4;4;4;5;4;3;33;46;2;35;2
16/06/20 19:17;16/06/20 19:21;0;109.7.216.5;100;246;1;16/06/20 19:21;R_rjXAC3gd306SitP;;;;;45,7480011;4,850006104;anonymous;EN;3;1;Explication des données (pas juste les graphiques sans information supplémentaire) et nombre de données importantes (pas juste un graphique);On remarque de suite que c'est automatisé (phrase pre ecrite en fonction du resultalt sur le graphique), du coup une fois que l'on sait lire le graphique, le service n'est plus utile;5;7;1;1;1;3;1;2;1;6;7;6;7;6;1;1;1;1;4;6;6;6;3;3;6;6;4;4;70;49;2;26;2
17/06/20 14:22;17/06/20 14:29;0;88.120.125.55;100;448;1;17/06/20 14:29;R_3MimYMW1b78fzdp;;;;;43,59950256;1,433197021;anonymous;EN;7;2;"Les avantages peuvent être le fait d'être suivi régulièrement, et d'éviter t'auto-évaluer ses besoins et risquer des mauvaises interprétations. Elle a l'air complète et polyvalente dans les domaines sur lesquels elle agit.";"L'inconvénient premier que je vois est le fait que c'est quand même très intrusif et peut devenir anxiogène pour certaines personnes. Une personne qui est mal dans sa peau ou a peu confiance peut se sentir stressée et utiliser l'application d'une mauvaise façon. Les écarts peuvent aussi devenir de vrais échecs et un vrai stress, alors que c'est tout à fait normal à mon avis. On peut se sentir emprisonnée et dépendante de cette application qui peut suivre tous ses mouvements et actions pendant la journée. ";3;5;2;1;1;2;1;1;1;6;5;5;5;5;2;1;1;1;1;6;6;3;4;4;6;4;3;4;1;1;2;26;2